{
  "type": "object",
  "properties": {
    "$schema": {
      "type": "string"
    },
    "name": {
      "type": "string",
      "minLength": 1
    },
    "label": {
      "anyOf": [
        {
          "type": "string",
          "minLength": 1
        },
        {
          "type": "object",
          "properties": {
            "de": {
              "type": "string",
              "minLength": 1
            },
            "en": {
              "type": "string",
              "minLength": 1
            }
          },
          "required": [
            "de",
            "en"
          ],
          "additionalProperties": false
        }
      ]
    },
    "email": {
      "type": "string",
      "format": "email"
    },
    "phone": {
      "type": "string"
    },
    "url": {
      "type": "string",
      "format": "uri"
    },
    "location": {
      "type": "object",
      "properties": {
        "address": {
          "type": "string"
        },
        "postalCode": {
          "type": "string"
        },
        "city": {
          "type": "string",
          "minLength": 1
        },
        "region": {
          "type": "string"
        },
        "countryCode": {
          "type": "string",
          "minLength": 2,
          "maxLength": 2
        }
      },
      "required": [
        "city",
        "countryCode"
      ],
      "additionalProperties": false
    },
    "summary": {
      "$ref": "#/properties/label"
    },
    "profiles": {
      "type": "array",
      "items": {
        "type": "object",
        "properties": {
          "network": {
            "type": "string",
            "minLength": 1
          },
          "username": {
            "type": "string",
            "minLength": 1
          },
          "url": {
            "type": "string",
            "format": "uri"
          }
        },
        "required": [
          "network",
          "username",
          "url"
        ],
        "additionalProperties": false
      },
      "default": []
    },
    "languages": {
      "type": "array",
      "items": {
        "type": "object",
        "properties": {
          "language": {
            "$ref": "#/properties/label"
          },
          "fluency": {
            "$ref": "#/properties/label"
          }
        },
        "required": [
          "language",
          "fluency"
        ],
        "additionalProperties": false
      },
      "default": []
    }
  },
  "required": [
    "name",
    "label",
    "email",
    "location",
    "summary"
  ],
  "additionalProperties": false,
  "$schema": "http://json-schema.org/draft-07/schema#",
  "title": "CV-Quelldaten: Stammdaten (basics.json)"
}
